{
  "type": "valuation_horizon_contract",
  "schema_version": 1,
  "coverage_cycle_id": "EXM-2026-W34-01",
  "valuation_quantity": "fair_value_per_share",
  "currency": "USD",
  "as_of": "2026-08-22",
  "source_cutoff_at": "2026-08-22T20:00:00Z",
  "reference_price": 10,
  "reference_price_at": "2026-08-20T20:00:00Z",
  "reference_price_source": "public_market_data_source",
  "primary_horizon": "2027-08-20",
  "display_semantics": "distribution_percentiles",
  "model": {
    "version": "example-v1",
    "method": "structured_elicitation",
    "calibration_status": "uncalibrated_shadow",
    "seed": 1,
    "sample_count": 100000,
    "code_path": "model.mjs",
    "verifier_path": "verify.mjs"
  },
  "horizons": [
    {
      "id": "twelve_month",
      "date": "2027-08-20",
      "months_from_reference": 12,
      "output_kind": "distribution",
      "p10": 6,
      "p50": 12,
      "p90": 18,
      "mean": 12.5,
      "probability_below_reference": 0.35,
      "probability_loss_30_pct": 0.15,
      "probability_loss_50_pct": 0.05,
      "bottom_decile_mean": 4.5
    }
  ],
  "horizon_relationship": {
    "kind": "single",
    "linkage_method": null,
    "value_correlation_method": null,
    "value_correlation": null,
    "probability_later_above_earlier": null,
    "transition_bands": [],
    "sensitivity_note": null
  }
}
