{
  "type": "valuation_horizon_contract",
  "schema_version": 1,
  "coverage_cycle_id": "WIX-2026-W35-01",
  "valuation_quantity": "fair_value_per_share",
  "currency": "USD",
  "as_of": "2026-08-31",
  "source_cutoff_at": "2026-08-31T23:59:59+02:00",
  "reference_price": 87.62,
  "reference_price_at": "2026-08-29T00:15:00Z",
  "reference_price_source": "StockAnalysis_historical_data_S&P_Global_Market_Intelligence",
  "primary_horizon": "2027-08-30",
  "display_semantics": "distribution_percentiles",
  "model": {
    "version": "wix_causal_sotp_capital_path_v5",
    "method": "structured_causal_elicitation_joint_sotp_monte_carlo",
    "calibration_status": "structured_elicitation_shadow_cross_sectionally_anchored",
    "seed": 20260830,
    "sample_count": 100000,
    "code_path": "model-2026-W35-distribution.mjs",
    "verifier_path": "verify-2026-W35-distribution.mjs"
  },
  "horizons": [
    {
      "id": "six_month",
      "date": "2027-02-28",
      "months_from_reference": 6,
      "output_kind": "distribution",
      "p10": 64.0222,
      "p50": 116.6008,
      "p90": 170.9255,
      "mean": 117.36,
      "probability_below_reference": 0.243,
      "probability_loss_30_pct": 0.088,
      "probability_loss_50_pct": 0.0291,
      "bottom_decile_mean": 49.0872
    },
    {
      "id": "twelve_month",
      "date": "2027-08-30",
      "months_from_reference": 12,
      "output_kind": "distribution",
      "p10": 67.7369,
      "p50": 127.7393,
      "p90": 195.0964,
      "mean": 129.9851,
      "probability_below_reference": 0.2,
      "probability_loss_30_pct": 0.0753,
      "probability_loss_50_pct": 0.0263,
      "bottom_decile_mean": 51.1608
    }
  ],
  "horizon_relationship": {
    "kind": "joint",
    "linkage_method": "Four dependent causal nodes—core Wix health, Base44 retained-production adoption, Base44 fully loaded economics, and outside-agent attachment/disintermediation—replace the former bundled regime. The same node states, shared frontier/operating factors, starting diluted-share/net-claims state, and sources-and-uses bridge carry through both formal horizons; checkpoint shocks are correlated. Claims reduction is tied to retained owner FCFE and earnout remeasurement to the simulated Base44 ARR path. The target-date denominator is held flat because current awards are already included and future award vintages are charged explicitly in owner FCFF. Four- and ten-month operating checkpoints are not additional fair-value horizons. There is no market-convergence forecast.",
    "value_correlation_method": "pearson",
    "value_correlation": 0.9713,
    "probability_later_above_earlier": 0.8415,
    "transition_bands": [
      {
        "label": "bottom_quartile",
        "earlier_band_upper_probability": 0.25,
        "earlier_band_sample_probability": 0.25,
        "later_mean": 71.5276,
        "later_median": 73.7021,
        "later_probability_below_reference": 0.7714
      },
      {
        "label": "lower_middle_quartile",
        "earlier_band_upper_probability": 0.5,
        "earlier_band_sample_probability": 0.25,
        "later_mean": 112.8341,
        "later_median": 112.2498,
        "later_probability_below_reference": 0.0285
      },
      {
        "label": "upper_middle_quartile",
        "earlier_band_upper_probability": 0.75,
        "earlier_band_sample_probability": 0.25,
        "later_mean": 143.933,
        "later_median": 143.1139,
        "later_probability_below_reference": 0
      },
      {
        "label": "top_quartile",
        "earlier_band_upper_probability": 1,
        "earlier_band_sample_probability": 0.25,
        "later_mean": 191.6456,
        "later_median": 187.6548,
        "later_probability_below_reference": 0
      }
    ],
    "sensitivity_note": "The formal distribution is target-date SOTP fair value; owner-FCFF DCF and cash multiples are non-voting cross-checks. Wix's three-year revenue-guidance error history informs a separately scoreable near-term revenue interval, while causal-node probabilities remain structured judgments. Three alternative same-evidence probability sets produce twelve-month medians of $126.89-$128.40; deliberately skeptical/favorable weights produce $109.66/$146.12 and 32.4%/11.8% frequencies below reference. With unchanged marginals, independent nodes produce P10 $73.75 and 5.4% frequency of fair value at least 30% below reference; stronger plausible dependence produces $61.89 and 9.8%, versus current $67.74 and 7.5%. Common-random-number stresses show that a +/-0.5x core multiple has the largest listed median effect (-$20.49/+$20.65), followed by a +/-2x Base44 multiple (-$10.12/+$10.59) and +/-2m diluted shares (+$5.70/-$5.23). Ten 50,000-draw seeds produce medians of $127.49-$128.33, showing that sampling noise is much smaller than assumption risk. The if-converted convention omits capped-call value through $267.89. Legacy contract fields named probability_loss_* mean probability that target-date fair value is 30%/50% below today's reference, not realized security loss."
  }
}
